{
  "candidate_id": "cand_csv_60c2496c",
  "full_name": "John Doe",
  "emails": [
    "john.doe@email.com"
  ],
  "phones": [
    "+919876543210"
  ],
  "location": {
    "city": "Hyderabad",
    "region": "Telangana",
    "country": "IN"
  },
  "links": {
    "linkedin": "https://www.linkedin.com/in/johndoe",
    "github": "https://github.com/johndoe",
    "portfolio": null,
    "other": []
  },
  "headline": "Full Stack Engineer at Microsoft",
  "years_experience": 4.5,
  "skills": [
    {
      "name": "React",
      "confidence": 1.0,
      "sources": [
        "recruiter.csv",
        "ats_profile.json",
        "resume_john_doe.pdf"
      ]
    },
    {
      "name": "Python",
      "confidence": 1.0,
      "sources": [
        "recruiter.csv",
        "ats_profile.json",
        "resume_john_doe.pdf"
      ]
    },
    {
      "name": "Docker",
      "confidence": 0.95,
      "sources": [
        "ats_profile.json",
        "resume_john_doe.pdf"
      ]
    },
    {
      "name": "JavaScript",
      "confidence": 0.65,
      "sources": [
        "resume_john_doe.pdf"
      ]
    },
    {
      "name": "Amazon Web Services",
      "confidence": 0.65,
      "sources": [
        "resume_john_doe.pdf"
      ]
    },
    {
      "name": "Kubernetes",
      "confidence": 0.65,
      "sources": [
        "resume_john_doe.pdf"
      ]
    },
    {
      "name": "PostgreSQL",
      "confidence": 0.65,
      "sources": [
        "resume_john_doe.pdf"
      ]
    },
    {
      "name": "Django",
      "confidence": 0.65,
      "sources": [
        "resume_john_doe.pdf"
      ]
    }
  ],
  "experience": [
    {
      "company": "Microsoft India",
      "title": "Software Engineer II",
      "start": "2022-06",
      "end": "Present",
      "summary": "Building scalable backend pipelines and reactive UI features. Managed cross-functional integration of candidate matching engines."
    },
    {
      "company": "Startup X",
      "title": "Software Engineer",
      "start": "2020-05",
      "end": "2022-05",
      "summary": "Developed full stack features using Django and React. Optimized SQL queries to improve response times by 30%."
    },
    {
      "company": "Microsoft",
      "title": "Software Engineer",
      "start": null,
      "end": "Present",
      "summary": null
    }
  ],
  "education": [
    {
      "institution": "IIT Hyderabad",
      "degree": "B.Tech in Computer Science ()",
      "field": "Computer Science",
      "end_year": "2022"
    }
  ],
  "overall_confidence": 0.83,
  "provenance": [
    {
      "field": "full_name",
      "source": "recruiter.csv",
      "method": "csv_parsing",
      "timestamp": "2026-07-01T07:28:58.859609",
      "confidence": 0.95
    },
    {
      "field": "emails",
      "source": "recruiter.csv",
      "method": "csv_parsing",
      "timestamp": "2026-07-01T07:28:58.859609",
      "confidence": 1.0
    },
    {
      "field": "phones",
      "source": "recruiter.csv",
      "method": "csv_parsing",
      "timestamp": "2026-07-01T07:28:58.859609",
      "confidence": 1.0
    },
    {
      "field": "location",
      "source": "recruiter.csv",
      "method": "csv_parsing",
      "timestamp": "2026-07-01T07:28:58.859609",
      "confidence": 0.85
    },
    {
      "field": "links",
      "source": "recruiter.csv",
      "method": "csv_parsing",
      "timestamp": "2026-07-01T07:28:58.859609",
      "confidence": 0.85
    },
    {
      "field": "headline",
      "source": "recruiter.csv",
      "method": "csv_parsing",
      "timestamp": "2026-07-01T07:28:58.859609",
      "confidence": 0.85
    },
    {
      "field": "years_experience",
      "source": "recruiter.csv",
      "method": "csv_parsing",
      "timestamp": "2026-07-01T07:28:58.859609",
      "confidence": 0.95
    },
    {
      "field": "skills",
      "source": "recruiter.csv",
      "method": "csv_parsing",
      "timestamp": "2026-07-01T07:28:58.859609",
      "confidence": 0.85
    },
    {
      "field": "experience",
      "source": "recruiter.csv",
      "method": "csv_parsing",
      "timestamp": "2026-07-01T07:28:58.859609",
      "confidence": 0.85
    },
    {
      "field": "emails",
      "source": "ats_profile.json",
      "method": "json_parsing",
      "timestamp": "2026-07-01T07:28:58.859886",
      "confidence": 1.0
    },
    {
      "field": "phones",
      "source": "ats_profile.json",
      "method": "json_parsing",
      "timestamp": "2026-07-01T07:28:58.859886",
      "confidence": 1.0
    },
    {
      "field": "location",
      "source": "ats_profile.json",
      "method": "json_parsing",
      "timestamp": "2026-07-01T07:28:58.859886",
      "confidence": 0.85
    },
    {
      "field": "links",
      "source": "ats_profile.json",
      "method": "json_parsing",
      "timestamp": "2026-07-01T07:28:58.859886",
      "confidence": 0.85
    },
    {
      "field": "headline",
      "source": "ats_profile.json",
      "method": "json_parsing",
      "timestamp": "2026-07-01T07:28:58.859886",
      "confidence": 0.85
    },
    {
      "field": "years_experience",
      "source": "ats_profile.json",
      "method": "json_parsing",
      "timestamp": "2026-07-01T07:28:58.859886",
      "confidence": 0.95
    },
    {
      "field": "skills",
      "source": "ats_profile.json",
      "method": "json_parsing",
      "timestamp": "2026-07-01T07:28:58.859886",
      "confidence": 0.85
    },
    {
      "field": "experience",
      "source": "ats_profile.json",
      "method": "json_parsing",
      "timestamp": "2026-07-01T07:28:58.859886",
      "confidence": 0.85
    },
    {
      "field": "education",
      "source": "ats_profile.json",
      "method": "json_parsing",
      "timestamp": "2026-07-01T07:28:58.859886",
      "confidence": 0.85
    },
    {
      "field": "full_name",
      "source": "resume_john_doe.pdf",
      "method": "pdf_text_extraction",
      "timestamp": "2026-07-01T07:28:58.893478",
      "confidence": 0.75
    },
    {
      "field": "emails",
      "source": "resume_john_doe.pdf",
      "method": "pdf_text_extraction",
      "timestamp": "2026-07-01T07:28:58.893478",
      "confidence": 0.85
    },
    {
      "field": "phones",
      "source": "resume_john_doe.pdf",
      "method": "pdf_text_extraction",
      "timestamp": "2026-07-01T07:28:58.893478",
      "confidence": 0.85
    },
    {
      "field": "location",
      "source": "resume_john_doe.pdf",
      "method": "pdf_text_extraction",
      "timestamp": "2026-07-01T07:28:58.893478",
      "confidence": 0.65
    },
    {
      "field": "years_experience",
      "source": "resume_john_doe.pdf",
      "method": "pdf_text_extraction",
      "timestamp": "2026-07-01T07:28:58.893478",
      "confidence": 0.75
    },
    {
      "field": "skills",
      "source": "resume_john_doe.pdf",
      "method": "pdf_text_extraction",
      "timestamp": "2026-07-01T07:28:58.893478",
      "confidence": 0.65
    },
    {
      "field": "experience",
      "source": "resume_john_doe.pdf",
      "method": "pdf_text_extraction",
      "timestamp": "2026-07-01T07:28:58.893478",
      "confidence": 0.65
    },
    {
      "field": "education",
      "source": "resume_john_doe.pdf",
      "method": "pdf_text_extraction",
      "timestamp": "2026-07-01T07:28:58.893478",
      "confidence": 0.65
    }
  ]
}